{"attempt":1,"dispatchId":"dispatch-alpha-1","exactModel":"gpt-5.6-sol","gateApprovalDigests":["sha256:bbbbbbbbbbbbbbbbbbbbbbbbbbbbbbbbbbbbbbbbbbbbbbbbbbbbbbbbbbbbbbbb"],"handoffDigest":"sha256:5555555555555555555555555555555555555555555555555555555555555555","planDigest":"sha256:99ac77d55d3deb45997283efbdf5749a94abc058814005b46fd32e048fb92cbd","prerequisites":[],"recommendedEffort":"high","registeredClone":{"branch":"cb/cb-rolling-1111111111111111/alpha","cloneId":"clone-alpha-1","gitCommonDirDigest":"sha256:cccccccccccccccccccccccccccccccccccccccccccccccccccccccccccccccc","repositoryRootDigest":"sha256:7777777777777777777777777777777777777777777777777777777777777777"},"requiredOutcomeGateIds":["gate-alpha"],"runId":"cb-rolling-1111111111111111","schemaVersion":"compass-builder.dispatch-record.v2","storyId":"alpha","workerStartSha":"aaaaaaaaaaaaaaaaaaaaaaaaaaaaaaaaaaaaaaaa","writeScopes":["src/alpha"]}
